{
  "manifestSchemaVersion": "1.0.0",
  "contractName": "courierdash-shared-contract",
  "contractVersion": "0.2.0-draft",
  "snapshotId": "courierdash-0.2.0-draft-c4a67d5-20260801t130748z",
  "snapshotVersion": "0.2.0-draft.3",
  "status": "partially_verified",
  "canonicalLocation": "docs/shared",
  "developmentPhase": "mobile_catch_up",
  "generatedFromEnvironment": "staging",
  "sourceWebCommit": "c4a67d58997b36dc6d4913c226d9cf489c816b2e",
  "schemaRevision": null,
  "latestMigration": null,
  "generatedAt": "2026-08-01T13:07:48Z",
  "compatibility": {
    "semverRangeFormat": "npm-semver",
    "web": ">=0.2.0-draft <0.3.0",
    "mobile": ">=0.2.0-draft <0.3.0",
    "postPublicSupport": "future_release_gate",
    "rolloutStrategy": "expand-migrate-verify-deprecate-remove"
  },
  "artifacts": [
    {
      "path": "docs/shared/SHARED_ARCHITECTURE.md",
      "sha256": "e747fc2b9beaf658e915f079f240f827ae85bedfc43cf28a0bd76c86f9b45324",
      "status": "present",
      "sourceRefs": [
        "docs/shared/SHARED_ARCHITECTURE.md"
      ],
      "generatedAt": "2026-08-01T10:01:49Z",
      "stagingStatus": "not_checked",
      "productionStatus": "not_checked",
      "verificationStatus": "partially_verified"
    },
    {
      "path": "docs/shared/SCHEMA_POLICY.md",
      "sha256": "ed75eac98dc8eca3d6f3f30b652c3d1ca3bd03c5252b1f83e332523765545783",
      "status": "present",
      "sourceRefs": [
        "supabase/schema.snapshot.json",
        "lib/database.types.ts",
        "supabase/migrations"
      ],
      "generatedAt": "2026-08-01T10:01:49Z",
      "stagingStatus": "not_checked",
      "productionStatus": "not_checked",
      "verificationStatus": "draft_pending_schema_snapshot"
    },
    {
      "path": "docs/shared/API_CONTRACT.md",
      "sha256": "3762377ff4c72e2d3dd482a728dc17e1a20a75efcebe82c85e12d2b653f837e3",
      "status": "present",
      "sourceRefs": [
        "app",
        "lib/supabase.ts",
        "lib/database.types.ts"
      ],
      "generatedAt": "2026-08-01T10:01:49Z",
      "stagingStatus": "not_checked",
      "productionStatus": "not_checked",
      "verificationStatus": "partially_verified"
    },
    {
      "path": "docs/shared/AUTH_AND_SECURITY.md",
      "sha256": "6aa5b32f42c628c109bf11f2cf04fdb460dc0da85bdf496267a87a221c7c7371",
      "status": "present",
      "sourceRefs": [
        "app/login/page.tsx",
        "app/forgot-password/page.tsx",
        "app/reset-password/page.tsx",
        "app/work/page.tsx",
        "lib/auth-route-policy.ts",
        "supabase/config.toml",
        "supabase/schema.snapshot.json"
      ],
      "generatedAt": "2026-08-01T13:07:48Z",
      "stagingStatus": "not_checked",
      "productionStatus": "not_checked",
      "verificationStatus": "reported_pending_snapshot"
    },
    {
      "path": "docs/shared/BUSINESS_RULES.md",
      "sha256": "17667a9bc12d6dd497cb5c4eedd2a947a053be8da94e7247746882da40037363",
      "status": "present",
      "sourceRefs": [
        "lib/work-platforms.ts",
        "app/work/year/annual-report-calculations.ts",
        "reported:mobile-statistics"
      ],
      "generatedAt": "2026-08-01T13:07:48Z",
      "stagingStatus": "not_checked",
      "productionStatus": "not_checked",
      "verificationStatus": "partially_verified"
    },
    {
      "path": "docs/shared/COMPATIBILITY_POLICY.md",
      "sha256": "30f4992f58a4509c5c5516a5574dbc8813f39ffea2894563185157da65a1854f",
      "status": "present",
      "sourceRefs": [
        "docs/shared/SHARED_ARCHITECTURE.md",
        "docs/shared/SCHEMA_POLICY.md"
      ],
      "generatedAt": "2026-08-01T13:07:48Z",
      "stagingStatus": "not_applicable",
      "productionStatus": "not_applicable",
      "verificationStatus": "proposed"
    },
    {
      "path": "docs/shared/CHANGELOG.md",
      "sha256": "5d2565ae20cac62d0d5dfec345205b3f278784fa409c1426b120451ea37c2ed4",
      "status": "present",
      "sourceRefs": [
        "docs/shared"
      ],
      "generatedAt": "2026-08-01T13:07:48Z",
      "stagingStatus": "not_checked",
      "productionStatus": "not_checked",
      "verificationStatus": "blocked"
    },
    {
      "path": "docs/shared/contract-manifest.schema.json",
      "sha256": "8a225f52b811cad54b15c815596d4c9324d66408f02ed90cf598ab8278b28db4",
      "status": "present",
      "sourceRefs": [
        "docs/shared/contract-manifest.json"
      ],
      "generatedAt": "2026-08-01T10:01:49Z",
      "stagingStatus": "not_applicable",
      "productionStatus": "not_applicable",
      "verificationStatus": "verified"
    },
    {
      "path": "docs/shared/fixtures/fixture.schema.json",
      "sha256": "c851f6968e788893edd5821f7c7e07568f96e8f3c5416ec412135b6010a2ab2a",
      "status": "present",
      "sourceRefs": [
        "docs/shared/fixtures"
      ],
      "generatedAt": "2026-08-01T10:01:49Z",
      "stagingStatus": "not_applicable",
      "productionStatus": "not_applicable",
      "verificationStatus": "verified"
    },
    {
      "path": "docs/shared/fixtures/income-calculations.json",
      "sha256": "197f665345f59b6cb206ccc66212509a4ca9d2f1465825e3f2da874e9a7222a7",
      "status": "present",
      "sourceRefs": [
        "lib/work-platforms.ts",
        "app/work/year/annual-report-calculations.ts",
        "app/work/year/annual-report-calculations.test.ts"
      ],
      "generatedAt": "2026-08-01T10:01:49Z",
      "stagingStatus": "not_checked",
      "productionStatus": "not_checked",
      "verificationStatus": "verified"
    },
    {
      "path": "docs/shared/fixtures/expense-calculations.json",
      "sha256": "e482a935d7e65967c5f3f3fd1185513604eeb6d458bfb9541dd166b9c7b83899",
      "status": "present",
      "sourceRefs": [
        "reported:expense-scope"
      ],
      "generatedAt": "2026-08-01T10:01:49Z",
      "stagingStatus": "not_checked",
      "productionStatus": "not_checked",
      "verificationStatus": "draft_pending_schema_snapshot"
    },
    {
      "path": "docs/shared/fixtures/rental-calculations.json",
      "sha256": "6590b7a4d4ea6526cd141bed633561c6cbeb3e2228af4b84cd6b3339675f3c79",
      "status": "present",
      "sourceRefs": [
        "reported:rental-requirements"
      ],
      "generatedAt": "2026-08-01T10:01:49Z",
      "stagingStatus": "not_checked",
      "productionStatus": "not_checked",
      "verificationStatus": "unresolved"
    },
    {
      "path": "docs/shared/fixtures/report-calculations.json",
      "sha256": "6d261c4bdfe0add56390bd8c20106975a0c3384fb26726b6b70f11e3f4dd5d91",
      "status": "present",
      "sourceRefs": [
        "app/work/year/annual-report-calculations.ts",
        "app/work/year/annual-report-calculations.test.ts"
      ],
      "generatedAt": "2026-08-01T10:01:49Z",
      "stagingStatus": "not_checked",
      "productionStatus": "not_checked",
      "verificationStatus": "verified"
    },
    {
      "path": "docs/shared/fixtures/timezone-cases.json",
      "sha256": "a44517a4b7eedfe3bd75d842f780d251ebb95929acd1b5c2b6bb01b2780296a2",
      "status": "present",
      "sourceRefs": [
        "reported:mobile-timezone",
        "app/work/page.tsx",
        "app/garage/page.tsx",
        "app/work/year/page.tsx"
      ],
      "generatedAt": "2026-08-01T10:01:49Z",
      "stagingStatus": "not_checked",
      "productionStatus": "not_checked",
      "verificationStatus": "reported_pending_snapshot"
    }
  ],
  "sharedFlows": [
    {
      "id": "auth",
      "implementationStatus": "implemented_unverified",
      "implementationCommit": "c4a67d58997b36dc6d4913c226d9cf489c816b2e",
      "reviewStatus": "passed",
      "acceptanceStatus": "accepted_by_web",
      "contractVersion": "0.2.0-draft",
      "verificationStatus": "partially_verified",
      "supportedCapabilities": [
        "email_password_login",
        "email_password_signup",
        "password_recovery",
        "logout",
        "client_session_guard"
      ],
      "missingCapabilities": [
        "verified_staging_settings",
        "verified_mobile_deep_links",
        "verified_confirmation_flow"
      ],
      "blockers": [
        "RISK-001",
        "RISK-009"
      ],
      "evidenceRefs": [
        "app/login/page.tsx",
        "app/forgot-password/page.tsx",
        "app/reset-password/page.tsx",
        "lib/auth-route-policy.ts",
        "supabase/config.toml",
        "mobile-audit:4ecfb48d99951539c7f5db73fb748667478ffb85:snapshot-0.2.0-draft.2"
      ]
    },
    {
      "id": "profile",
      "implementationStatus": "blocked",
      "implementationCommit": "c4a67d58997b36dc6d4913c226d9cf489c816b2e",
      "reviewStatus": "failed",
      "acceptanceStatus": "not_assessed",
      "contractVersion": "0.2.0-draft",
      "verificationStatus": "blocked",
      "supportedCapabilities": [
        "nickname_unique_lookup",
        "owner_profile_upsert"
      ],
      "missingCapabilities": [
        "single_profile_creation_mechanism",
        "confirmed_signup_bootstrap",
        "deterministic_retry_policy"
      ],
      "blockers": [
        "RISK-001",
        "RISK-005",
        "RISK-006"
      ],
      "evidenceRefs": [
        "app/page.tsx",
        "app/login/page.tsx",
        "app/work/page.tsx",
        "supabase/schema.snapshot.json",
        "mobile-audit:4ecfb48d99951539c7f5db73fb748667478ffb85:snapshot-0.2.0-draft.2"
      ]
    },
    {
      "id": "work",
      "implementationStatus": "contract_verified",
      "implementationCommit": "c4a67d58997b36dc6d4913c226d9cf489c816b2e",
      "reviewStatus": "passed",
      "acceptanceStatus": "accepted_by_both",
      "contractVersion": "0.2.0-draft",
      "verificationStatus": "partially_verified",
      "supportedCapabilities": [
        "dated_record_crud",
        "six_platforms",
        "app_tips",
        "cash_tips",
        "bonuses",
        "orders",
        "history_edit_delete"
      ],
      "missingCapabilities": [
        "staging_schema_verification",
        "device_local_date_parity",